{
  "schema-version": 1,
  "project-root": ".",
  "app-root": "src/SampleApp",
  "requested-artifacts": [
    {
      "operation": "create",
      "path": "src/SampleApp/Setup/CQSampleSetup.Table.al",
      "object-type": "table",
      "object-id": 70000,
      "object-name": "CQ Sample Setup",
      "intent": "Store one setup record with an enabled flag and an appropriate data classification."
    }
  ],
  "related-file-allowlist": [
    "src/SampleApp/app.json",
    "src/SampleApp/Setup/CQSampleSetup.Page.al"
  ],
  "context": {
    "countries": [
      "w1"
    ],
    "application-areas": [
      "all"
    ]
  },
  "target": {
    "effective-bc-major": 28,
    "runtime": "15.0",
    "app": {
      "id": "11111111-1111-4111-8111-111111111111",
      "name": "CQ Sample App",
      "publisher": "Contoso",
      "version": "1.0.0.0",
      "platform": "28.0.0.0",
      "application": "28.0.0.0",
      "target": "Cloud",
      "dependencies": [],
      "id-ranges": [
        {
          "from": 70000,
          "to": 70049
        }
      ]
    }
  },
  "generation-settings": {
    "context-budget": 24
  },
  "app-json-provenance": {
    "path": "src/SampleApp/app.json",
    "sha256": "aaaaaaaaaaaaaaaaaaaaaaaaaaaaaaaaaaaaaaaaaaaaaaaaaaaaaaaaaaaaaaaa"
  }
}
